{
  "$schema": "../../../schemas/collision_pi_diagram_source_c.schema.json",
  "course_id": "collision-pi",
  "section_id": "C",
  "version": "1.0.0",
  "source_catalog": [
    {"id": "video-main", "location": "sources/theory/弹性碰撞与π.txt"},
    {"id": "openstax-ellipse", "location": "https://openstax.org/books/precalculus-2e/pages/10-1-the-ellipse"},
    {"id": "openstax-angles", "location": "https://openstax.org/books/precalculus-2e/pages/5-1-angles"},
    {"id": "openstax-unit-circle", "location": "https://openstax.org/books/precalculus-2e/pages/5-2-unit-circle-sine-and-cosine-functions"},
    {"id": "openstax-momentum", "location": "https://openstax.org/books/physics/pages/8-2-conservation-of-momentum"},
    {"id": "openstax-elastic", "location": "https://openstax.org/books/college-physics/pages/8-4-elastic-collisions-in-one-dimension"}
  ],
  "diagrams": [
    {"diagram_id":"cp-c-velocity-plane-quadrants","node_id":"C1.2","template_kind":"velocity_plane","coordinate_system":"velocity_raw","parameters":{"x_range":[-3,3],"y_range":[-3,3],"states":[{"v_large":1,"v_small":1},{"v_large":-1,"v_small":1},{"v_large":-1,"v_small":-1},{"v_large":1,"v_small":-1}],"quadrant_labels":{"I":"均向右","II":"大物块向左","III":"均向左","IV":"小物块向左"}},"labels":{"x_axis":"vM","y_axis":"vm"},"caption":"速度平面的四个方向象限。","alt_text":"以大物块和小物块速度为轴的四象限状态点。","source_refs":["video-main"]},
    {"diagram_id":"cp-c-velocity-plane-initial","node_id":"C1.4","template_kind":"velocity_plane","coordinate_system":"velocity_raw","parameters":{"x_range":[-3,3],"y_range":[-3,3],"states":[{"v_large":-2,"v_small":0}],"quadrant_labels":{"initial":"大物块左行，小物块静止"}},"labels":{"x_axis":"vM","y_axis":"vm"},"caption":"典型碰撞链的初始速度点。","alt_text":"速度平面上大物块速度为负而小物块速度为零的状态。","source_refs":["video-main"]},
    {"diagram_id":"cp-c-velocity-plane-terminal","node_id":"C1.4","template_kind":"velocity_plane","coordinate_system":"velocity_raw","parameters":{"x_range":[-3,3],"y_range":[-3,3],"states":[{"v_large":2,"v_small":1}],"quadrant_labels":{"terminal":"vM大于等于vm且均非负"}},"labels":{"x_axis":"vM","y_axis":"vm"},"caption":"终态速度点位于右侧有序区域。","alt_text":"两个正速度且大物块速度不小于小物块速度的状态。","source_refs":["video-main"]},
    {"diagram_id":"cp-c-velocity-plane-state-vs-path","node_id":"C1.3","template_kind":"velocity_plane","coordinate_system":"velocity_raw","parameters":{"x_range":[-3,3],"y_range":[-3,3],"states":[{"v_large":-2,"v_small":0},{"v_large":1,"v_small":-1}],"quadrant_labels":{"note":"点表示速度状态，不表示空间路径"}},"labels":{"x_axis":"vM","y_axis":"vm"},"caption":"相图中的点是速度状态。","alt_text":"两个速度状态点用于区分相图与真实位置轨迹。","source_refs":["video-main"]},

    {"diagram_id":"cp-c-energy-ellipse-equal-mass","node_id":"C2.1","template_kind":"energy_ellipse","coordinate_system":"velocity_raw","parameters":{"mass_large":1,"mass_small":1,"energy":2,"states":[{"v_large":2,"v_small":0},{"v_large":0,"v_small":2},{"v_large":-2,"v_small":0}]},"labels":{"energy":"MvM²+mvm²=2E"},"caption":"等质量时的等能圆。","alt_text":"等质量的三个速度状态位于同一等能圆上。","source_refs":["video-main","openstax-ellipse"]},
    {"diagram_id":"cp-c-energy-ellipse-ratio-4","node_id":"C2.2","template_kind":"energy_ellipse","coordinate_system":"velocity_raw","parameters":{"mass_large":4,"mass_small":1,"energy":2,"states":[{"v_large":1,"v_small":0},{"v_large":0,"v_small":2},{"v_large":-1,"v_small":0}]},"labels":{"energy":"4vM²+vm²=4"},"caption":"质量比四时的能量椭圆。","alt_text":"横向较窄的能量椭圆展示质量系数改变刻度。","source_refs":["video-main","openstax-ellipse"]},
    {"diagram_id":"cp-c-energy-ellipse-ratio-16","node_id":"C2.2","template_kind":"energy_ellipse","coordinate_system":"velocity_raw","parameters":{"mass_large":16,"mass_small":1,"energy":8,"states":[{"v_large":1,"v_small":0},{"v_large":0,"v_small":4},{"v_large":-1,"v_small":0}]},"labels":{"energy":"16vM²+vm²=16"},"caption":"质量比十六时的能量椭圆。","alt_text":"质量更大时横轴速度范围更小的能量椭圆。","source_refs":["video-main","openstax-ellipse"]},
    {"diagram_id":"cp-c-energy-ellipse-same-energy","node_id":"C2.3","template_kind":"energy_ellipse","coordinate_system":"velocity_raw","parameters":{"mass_large":4,"mass_small":1,"energy":8,"states":[{"v_large":2,"v_small":0},{"v_large":0,"v_small":4},{"v_large":-2,"v_small":0}]},"labels":{"energy":"4vM²+vm²=16"},"caption":"同一椭圆上的状态共享总动能。","alt_text":"三个不同速度分配的状态位于同一个能量椭圆上。","source_refs":["video-main","openstax-ellipse"]},

    {"diagram_id":"cp-c-scale-pair-equal-mass","node_id":"C3.1","template_kind":"scale_pair","coordinate_system":"velocity_weighted","parameters":{"mass_large":1,"mass_small":1,"energy":2,"raw_states":[{"v_large":-2,"v_small":0},{"v_large":0,"v_small":2}],"weighted_states":[{"mass_large":1,"mass_small":1,"v_large":-2,"v_small":0,"x":-2,"y":0},{"mass_large":1,"mass_small":1,"v_large":0,"v_small":2,"x":0,"y":2}],"source_coordinate_system":"velocity_raw","raw_coordinate_system":"velocity_raw","weighted_coordinate_system":"velocity_weighted"},"labels":{"left":"速度坐标","right":"质量加权坐标"},"caption":"等质量下两种坐标的对应。","alt_text":"左侧原始速度坐标和右侧质量加权坐标的相同状态对应。","source_refs":["video-main"]},
    {"diagram_id":"cp-c-scale-pair-ratio-4","node_id":"C3.1","template_kind":"scale_pair","coordinate_system":"velocity_weighted","parameters":{"mass_large":4,"mass_small":1,"energy":2,"raw_states":[{"v_large":-1,"v_small":0},{"v_large":0,"v_small":2}],"weighted_states":[{"mass_large":4,"mass_small":1,"v_large":-1,"v_small":0,"x":-2,"y":0},{"mass_large":4,"mass_small":1,"v_large":0,"v_small":2,"x":0,"y":2}],"source_coordinate_system":"velocity_raw","raw_coordinate_system":"velocity_raw","weighted_coordinate_system":"velocity_weighted"},"labels":{"left":"速度椭圆","right":"加权圆"},"caption":"质量比四的椭圆缩放为圆。","alt_text":"质量比四的原始速度点和加权圆上对应点。","source_refs":["video-main","openstax-ellipse"]},
    {"diagram_id":"cp-c-scale-pair-ratio-16","node_id":"C3.2","template_kind":"scale_pair","coordinate_system":"velocity_weighted","parameters":{"mass_large":16,"mass_small":1,"energy":8,"raw_states":[{"v_large":-1,"v_small":0},{"v_large":0,"v_small":4}],"weighted_states":[{"mass_large":16,"mass_small":1,"v_large":-1,"v_small":0,"x":-4,"y":0},{"mass_large":16,"mass_small":1,"v_large":0,"v_small":4,"x":0,"y":4}],"source_coordinate_system":"velocity_raw","raw_coordinate_system":"velocity_raw","weighted_coordinate_system":"velocity_weighted"},"labels":{"left":"速度椭圆","right":"加权圆"},"caption":"平方根质量缩放吸收质量系数。","alt_text":"质量比十六的椭圆被坐标缩放成半径四的圆。","source_refs":["video-main"]},
    {"diagram_id":"cp-c-scale-pair-ratio-100","node_id":"C3.3","template_kind":"scale_pair","coordinate_system":"velocity_weighted","parameters":{"mass_large":100,"mass_small":1,"energy":50,"raw_states":[{"v_large":-1,"v_small":0},{"v_large":0,"v_small":10}],"weighted_states":[{"mass_large":100,"mass_small":1,"v_large":-1,"v_small":0,"x":-10,"y":0},{"mass_large":100,"mass_small":1,"v_large":0,"v_small":10,"x":0,"y":10}],"source_coordinate_system":"velocity_raw","raw_coordinate_system":"velocity_raw","weighted_coordinate_system":"velocity_weighted"},"labels":{"left":"速度椭圆","right":"加权圆"},"caption":"质量比一百时的标准化。","alt_text":"质量比一百的狭长速度椭圆与半径十的加权圆对应。","source_refs":["video-main"]},
    {"diagram_id":"cp-c-scale-pair-error-check","node_id":"C3.4","template_kind":"scale_pair","coordinate_system":"velocity_weighted","parameters":{"mass_large":4,"mass_small":1,"energy":2,"raw_states":[{"v_large":1,"v_small":0},{"v_large":0,"v_small":-2}],"weighted_states":[{"mass_large":4,"mass_small":1,"v_large":1,"v_small":0,"x":2,"y":0},{"mass_large":4,"mass_small":1,"v_large":0,"v_small":-2,"x":0,"y":-2}],"source_coordinate_system":"velocity_raw","raw_coordinate_system":"velocity_raw","weighted_coordinate_system":"velocity_weighted"},"labels":{"left":"物理速度","right":"绘图坐标"},"caption":"换刻度不改变物理状态。","alt_text":"两种坐标表示同一组带符号速度，用于检查坐标含义。","source_refs":["video-main"]},

    {"diagram_id":"cp-c-momentum-chord-ratio-1","node_id":"C4.1","template_kind":"momentum_chord","coordinate_system":"velocity_weighted","parameters":{"mass_large":1,"mass_small":1,"energy":2,"momentum_values":[2],"intersections":[{"mass_large":1,"mass_small":1,"v_large":2,"v_small":0,"x":2,"y":0,"momentum":2},{"mass_large":1,"mass_small":1,"v_large":0,"v_small":2,"x":0,"y":2,"momentum":2}]},"labels":{"line":"x+y=P"},"caption":"等质量动量线截取能量圆的弦。","alt_text":"斜率为负的动量线与能量圆相交于两个状态点。","source_refs":["video-main","openstax-momentum"]},
    {"diagram_id":"cp-c-momentum-chord-ratio-4","node_id":"C4.2","template_kind":"momentum_chord","coordinate_system":"velocity_weighted","parameters":{"mass_large":4,"mass_small":1,"energy":2,"momentum_values":[4],"intersections":[{"mass_large":4,"mass_small":1,"v_large":1,"v_small":0,"x":2,"y":0,"momentum":4},{"mass_large":4,"mass_small":1,"v_large":0.6,"v_small":1.6,"x":1.2,"y":1.6,"momentum":4}]},"labels":{"line":"2x+y=P"},"caption":"质量比四决定动量线的方向。","alt_text":"质量比四的动量线连接能量圆上的两个碰撞状态。","source_refs":["video-main","openstax-momentum"]},
    {"diagram_id":"cp-c-momentum-chord-ratio-16","node_id":"C4.2","template_kind":"momentum_chord","coordinate_system":"velocity_weighted","parameters":{"mass_large":16,"mass_small":1,"energy":8,"momentum_values":[4],"intersections":[{"mass_large":16,"mass_small":1,"v_large":0,"v_small":4,"x":0,"y":4,"momentum":4},{"mass_large":16,"mass_small":1,"v_large":0.47058823529411764,"v_small":-3.5294117647058822,"x":1.8823529411764706,"y":-3.5294117647058822,"momentum":4}]},"labels":{"line":"4x+y=P"},"caption":"质量比十六的动量弦。","alt_text":"更陡的动量线与半径四能量圆的两个交点。","source_refs":["video-main","openstax-momentum"]},
    {"diagram_id":"cp-c-momentum-chord-parallel","node_id":"C4.3","template_kind":"momentum_chord","coordinate_system":"velocity_weighted","parameters":{"mass_large":4,"mass_small":1,"energy":2,"momentum_values":[2,4],"intersections":[{"mass_large":4,"mass_small":1,"v_large":1,"v_small":0,"x":2,"y":0,"momentum":4},{"mass_large":4,"mass_small":1,"v_large":0.6,"v_small":1.6,"x":1.2,"y":1.6,"momentum":4}]},"labels":{"family":"2x+y=P"},"caption":"不同动量值给出平行的动量线。","alt_text":"同一质量比下两条平行动量线及其中一条的圆交点。","source_refs":["video-main","openstax-momentum"]},